{
  "name": "Dumb Bimbo Whore",
  "icon": "fa-dumpster-fire",
  "description": "Plastic surgery bimbo with vacant eyes",
  "settings": {
    "hairStyle": "bleached blonde bimbo hair",
    "eyes": "dumb vacant whore eyes",
    "face": "plastic surgery whore face",
    "lips": "full collagen whore lips",
    "makeup": "heavy whore makeup",
    "bodyType": "bimbo plastic surgery body",
    "bust": "huge fake whore tits",
    "ass": "huge fake whore ass",
    "realismLevel": 10,
    "clothingStyle": "micro whore bikini",
    "material": "shiny latex",
    "pussy": "bleached whore pussy",
    "cum": "cum on whore face",
    "pose": "spread eagle whore pose",
    "lighting": "professional porn studio lighting",
    "imageStyle": "professional photography",
    "perspective": "POV shot",
    "cameraSettings": "shot on Canon EOS R5, 50mm lens, f/1.8, ISO 100"
  }
}