{
  "name": "Street Whore",
  "icon": "fa-street-view",
  "description": "Back alley cheap whore",
  "settings": {
    "hairStyle": "dirty blonde whore hair",
    "eyes": "desperate whore eyes",
    "face": "street whore face",
    "lips": "natural whore lips",
    "makeup": "street whore makeup",
    "bodyType": "natural whore body",
    "bust": "average whore tits",
    "ass": "average whore ass",
    "realismLevel": 10,
    "clothingStyle": "torn fishnet stockings",
    "material": "torn fishnet",
    "pussy": "natural whore bush",
    "cum": "cum on whore tits",
    "pose": "bent over presenting whore ass",
    "lighting": "back alley lighting",
    "imageStyle": "gritty realistic photography",
    "perspective": "third person shot",
    "cameraSettings": "shot on smartphone camera, realistic"
  }
}