{
  "name": "Car Whore",
  "icon": "fa-car",
  "description": "Backseat car whore",
  "settings": {
    "hairStyle": "wet whore hair",
    "eyes": "fucked-out whore eyes",
    "face": "street whore face",
    "lips": "ruined lipstick whore lips",
    "makeup": "smeared whore makeup",
    "bodyType": "natural whore body",
    "bust": "average whore tits",
    "ass": "average whore ass",
    "realismLevel": 10,
    "clothingStyle": "completely naked whore",
    "material": "none",
    "pussy": "wet whore pussy",
    "cum": "cum dripping from whore pussy",
    "pose": "doggy style whore pose",
    "lighting": "car interior lighting",
    "imageStyle": "amateur photography",
    "perspective": "POV shot",
    "cameraSettings": "shot on smartphone camera, realistic"
  }
}