{
  "name": "Goth Whore",
  "icon": "fa-skull",
  "description": "Dark alternative whore",
  "settings": {
    "hairStyle": "jet black slut hair",
    "eyes": "dominant whore eyes",
    "face": "natural born whore face",
    "lips": "red lipstick whore lips",
    "makeup": "heavy whore makeup",
    "bodyType": "skinny whore body",
    "bust": "small whore tits",
    "ass": "small tight whore ass",
    "realismLevel": 10,
    "clothingStyle": "leather whore outfit",
    "material": "shiny latex",
    "pussy": "shaved whore pussy",
    "cum": "multiple loads on whore",
    "pose": "riding cock whore pose",
    "lighting": "dark brothel lighting",
    "imageStyle": "gritty realistic photography",
    "perspective": "from behind shot",
    "cameraSettings": "shot on Canon EOS R5, 50mm lens, f/1.8, ISO 100"
  }
}