{
  "name": "Asian Whore",
  "icon": "fa-yin-yang",
  "description": "Submissive Asian whore",
  "settings": {
    "hairStyle": "straight black whore hair",
    "eyes": "submissive whore eyes",
    "face": "innocent turned whore face",
    "lips": "natural whore lips",
    "makeup": "natural whore makeup",
    "bodyType": "petite whore body",
    "bust": "small whore tits",
    "ass": "small tight whore ass",
    "realismLevel": 10,
    "clothingStyle": "revealing party dress",
    "material": "see-through mesh",
    "pussy": "neatly trimmed whore pussy",
    "cum": "cum filled whore pussy",
    "pose": "doggy style whore pose",
    "lighting": "professional porn studio lighting",
    "imageStyle": "professional photography",
    "perspective": "from above shot",
    "cameraSettings": "shot on Sony A7IV, 35mm lens, f/2.0, ISO 200"
  }
}