{
  "name": "Nurse Whore",
  "icon": "fa-plus",
  "description": "Medical professional whore",
  "settings": {
    "hairStyle": "perfect salon whore hair",
    "eyes": "professional whore eyes",
    "face": "high-class escort face",
    "lips": "red lipstick whore lips",
    "makeup": "high-class whore makeup",
    "bodyType": "athletic whore body",
    "bust": "average whore tits",
    "ass": "average whore ass",
    "realismLevel": 10,
    "clothingStyle": "nurse whore uniform",
    "material": "cotton uniform",
    "pussy": "shaved whore pussy",
    "cum": "clean whore",
    "pose": "whore presenting her holes",
    "lighting": "hospital lighting",
    "imageStyle": "professional photography",
    "perspective": "full body shot",
    "cameraSettings": "shot on Canon EOS R5, 50mm lens, f/1.8, ISO 100"
  }
}