{
  "name": "BBW Whore",
  "icon": "fa-weight",
  "description": "Big beautiful whore",
  "settings": {
    "hairStyle": "redhead whore hair",
    "eyes": "sultry experienced whore eyes",
    "face": "natural born whore face",
    "lips": "pouty whore lips",
    "makeup": "heavy whore makeup",
    "bodyType": "chubby whore body",
    "bust": "big natural whore tits",
    "ass": "big natural whore ass",
    "realismLevel": 10,
    "clothingStyle": "skimpy whore bikini",
    "material": "wet sheer material",
    "pussy": "natural whore bush",
    "cum": "cum on whore tits",
    "pose": "squatting whore pose",
    "lighting": "professional porn studio lighting",
    "imageStyle": "professional photography",
    "perspective": "third person shot",
    "cameraSettings": "shot on professional DSLR, sharp focus"
  }
}