[
  {
    "name": "Dumb Bimbo Whore",
    "icon": "fa-dumpster-fire",
    "description": "Plastic surgery bimbo with vacant eyes",
    "settings": {
      "hairStyle": "bleached blonde bimbo hair",
      "eyes": "dumb vacant whore eyes",
      "face": "plastic surgery whore face",
      "lips": "full collagen whore lips",
      "makeup": "heavy whore makeup",
      "bodyType": "bimbo plastic surgery body",
      "bust": "huge fake whore tits",
      "ass": "huge fake whore ass",
      "realismLevel": 10,
      "clothingStyle": "micro whore bikini",
      "material": "shiny latex",
      "pussy": "bleached whore pussy",
      "cum": "cum on whore face",
      "pose": "spread eagle whore pose",
      "lighting": "professional porn studio lighting",
      "imageStyle": "professional photography",
      "perspective": "POV shot",
      "cameraSettings": "shot on Canon EOS R5, 50mm lens, f/1.8, ISO 100"
    }
  },
  {
    "name": "Street Whore",
    "icon": "fa-street-view",
    "description": "Back alley cheap whore",
    "settings": {
      "hairStyle": "dirty blonde whore hair",
      "eyes": "desperate whore eyes",
      "face": "street whore face",
      "lips": "natural whore lips",
      "makeup": "street whore makeup",
      "bodyType": "natural whore body",
      "bust": "average whore tits",
      "ass": "average whore ass",
      "realismLevel": 10,
      "clothingStyle": "torn fishnet stockings",
      "material": "torn fishnet",
      "pussy": "natural whore bush",
      "cum": "cum on whore tits",
      "pose": "bent over presenting whore ass",
      "lighting": "back alley lighting",
      "imageStyle": "gritty realistic photography",
      "perspective": "third person shot",
      "cameraSettings": "shot on smartphone camera, realistic"
    }
  },
  {
    "name": "High-Class Escort",
    "icon": "fa-gem",
    "description": "Expensive luxury whore",
    "settings": {
      "hairStyle": "perfect salon whore hair",
      "eyes": "high-class whore eyes",
      "face": "high-class escort face",
      "lips": "red lipstick whore lips",
      "makeup": "high-class whore makeup",
      "bodyType": "athletic whore body",
      "bust": "big natural whore tits",
      "ass": "big natural whore ass",
      "realismLevel": 10,
      "clothingStyle": "see-through whore dress",
      "material": "wet silk",
      "pussy": "shaved whore pussy",
      "cum": "clean whore",
      "pose": "whore presenting her holes",
      "lighting": "hotel room lighting",
      "imageStyle": "glamour photography",
      "perspective": "full body shot",
      "cameraSettings": "shot on Sony A7IV, 35mm lens, f/2.0, ISO 200"
    }
  },
  {
    "name": "Milf Whore",
    "icon": "fa-venus-double",
    "description": "Experienced mother whore",
    "settings": {
      "hairStyle": "brunette slut hair",
      "eyes": "sultry experienced whore eyes",
      "face": "experienced milf whore face",
      "lips": "natural whore lips",
      "makeup": "natural whore makeup",
      "bodyType": "milf whore body",
      "bust": "saggy milf whore tits",
      "ass": "saggy milf whore ass",
      "realismLevel": 10,
      "clothingStyle": "whore lingerie",
      "material": "lace lingerie",
      "pussy": "landing strip whore pussy",
      "cum": "creampie leaking from whore pussy",
      "pose": "missionary whore pose",
      "lighting": "amateur bedroom lighting",
      "imageStyle": "amateur photography",
      "perspective": "POV shot",
      "cameraSettings": "shot on professional DSLR, sharp focus"
    }
  },
  {
    "name": "College Slut",
    "icon": "fa-graduation-cap",
    "description": "Young college whore",
    "settings": {
      "hairStyle": "messy just-fucked hair",
      "eyes": "innocent turned whore eyes",
      "face": "innocent turned whore face",
      "lips": "glossy whore lips",
      "makeup": "smeared whore makeup",
      "bodyType": "young whore body",
      "bust": "perky young whore tits",
      "ass": "perky young whore ass",
      "realismLevel": 10,
      "clothingStyle": "wet white t-shirt",
      "material": "wet cotton",
      "pussy": "fully shaved bare whore pussy",
      "cum": "cum dripping from whore pussy",
      "pose": "on knees sucking cock pose",
      "lighting": "natural window light",
      "imageStyle": "raw photography",
      "perspective": "close up shot",
      "cameraSettings": "shot on Nikon Z9, 85mm lens, f/1.4, ISO 100"
    }
  },
  {
    "name": "Goth Whore",
    "icon": "fa-skull",
    "description": "Dark alternative whore",
    "settings": {
      "hairStyle": "jet black slut hair",
      "eyes": "dominant whore eyes",
      "face": "natural born whore face",
      "lips": "red lipstick whore lips",
      "makeup": "heavy whore makeup",
      "bodyType": "skinny whore body",
      "bust": "small whore tits",
      "ass": "small tight whore ass",
      "realismLevel": 10,
      "clothingStyle": "leather whore outfit",
      "material": "shiny latex",
      "pussy": "shaved whore pussy",
      "cum": "multiple loads on whore",
      "pose": "riding cock whore pose",
      "lighting": "dark brothel lighting",
      "imageStyle": "gritty realistic photography",
      "perspective": "from behind shot",
      "cameraSettings": "shot on Canon EOS R5, 50mm lens, f/1.8, ISO 100"
    }
  },
  {
    "name": "Asian Whore",
    "icon": "fa-yin-yang",
    "description": "Submissive Asian whore",
    "settings": {
      "hairStyle": "straight black whore hair",
      "eyes": "submissive whore eyes",
      "face": "innocent turned whore face",
      "lips": "natural whore lips",
      "makeup": "natural whore makeup",
      "bodyType": "petite whore body",
      "bust": "small whore tits",
      "ass": "small tight whore ass",
      "realismLevel": 10,
      "clothingStyle": "revealing party dress",
      "material": "see-through mesh",
      "pussy": "neatly trimmed whore pussy",
      "cum": "cum filled whore pussy",
      "pose": "doggy style whore pose",
      "lighting": "professional porn studio lighting",
      "imageStyle": "professional photography",
      "perspective": "from above shot",
      "cameraSettings": "shot on Sony A7IV, 35mm lens, f/2.0, ISO 200"
    }
  },
  {
    "name": "BBW Whore",
    "icon": "fa-weight",
    "description": "Big beautiful whore",
    "settings": {
      "hairStyle": "redhead whore hair",
      "eyes": "sultry experienced whore eyes",
      "face": "natural born whore face",
      "lips": "pouty whore lips",
      "makeup": "heavy whore makeup",
      "bodyType": "chubby whore body",
      "bust": "big natural whore tits",
      "ass": "big natural whore ass",
      "realismLevel": 10,
      "clothingStyle": "skimpy whore bikini",
      "material": "wet sheer material",
      "pussy": "natural whore bush",
      "cum": "cum on whore tits",
      "pose": "squatting whore pose",
      "lighting": "professional porn studio lighting",
      "imageStyle": "professional photography",
      "perspective": "third person shot",
      "cameraSettings": "shot on professional DSLR, sharp focus"
    }
  },
  {
    "name": "Nurse Whore",
    "icon": "fa-plus",
    "description": "Medical professional whore",
    "settings": {
      "hairStyle": "perfect salon whore hair",
      "eyes": "professional whore eyes",
      "face": "high-class escort face",
      "lips": "red lipstick whore lips",
      "makeup": "high-class whore makeup",
      "bodyType": "athletic whore body",
      "bust": "average whore tits",
      "ass": "average whore ass",
      "realismLevel": 10,
      "clothingStyle": "nurse whore uniform",
      "material": "cotton uniform",
      "pussy": "shaved whore pussy",
      "cum": "clean whore",
      "pose": "whore presenting her holes",
      "lighting": "hospital lighting",
      "imageStyle": "professional photography",
      "perspective": "full body shot",
      "cameraSettings": "shot on Canon EOS R5, 50mm lens, f/1.8, ISO 100"
    }
  },
  {
    "name": "Car Whore",
    "icon": "fa-car",
    "description": "Backseat car whore",
    "settings": {
      "hairStyle": "wet whore hair",
      "eyes": "fucked-out whore eyes",
      "face": "street whore face",
      "lips": "ruined lipstick whore lips",
      "makeup": "smeared whore makeup",
      "bodyType": "natural whore body",
      "bust": "average whore tits",
      "ass": "average whore ass",
      "realismLevel": 10,
      "clothingStyle": "completely naked whore",
      "material": "none",
      "pussy": "wet whore pussy",
      "cum": "cum dripping from whore pussy",
      "pose": "doggy style whore pose",
      "lighting": "car interior lighting",
      "imageStyle": "amateur photography",
      "perspective": "POV shot",
      "cameraSettings": "shot on smartphone camera, realistic"
    }
  }
]