{
  "name": "College Slut",
  "icon": "fa-graduation-cap",
  "description": "Young college whore",
  "settings": {
    "hairStyle": "messy just-fucked hair",
    "eyes": "innocent turned whore eyes",
    "face": "innocent turned whore face",
    "lips": "glossy whore lips",
    "makeup": "smeared whore makeup",
    "bodyType": "young whore body",
    "bust": "perky young whore tits",
    "ass": "perky young whore ass",
    "realismLevel": 10,
    "clothingStyle": "wet white t-shirt",
    "material": "wet cotton",
    "pussy": "fully shaved bare whore pussy",
    "cum": "cum dripping from whore pussy",
    "pose": "on knees sucking cock pose",
    "lighting": "natural window light",
    "imageStyle": "raw photography",
    "perspective": "close up shot",
    "cameraSettings": "shot on Nikon Z9, 85mm lens, f/1.4, ISO 100"
  }
}