{
  "name": "High-Class Escort",
  "icon": "fa-gem",
  "description": "Expensive luxury whore",
  "settings": {
    "hairStyle": "perfect salon whore hair",
    "eyes": "high-class whore eyes",
    "face": "high-class escort face",
    "lips": "red lipstick whore lips",
    "makeup": "high-class whore makeup",
    "bodyType": "athletic whore body",
    "bust": "big natural whore tits",
    "ass": "big natural whore ass",
    "realismLevel": 10,
    "clothingStyle": "see-through whore dress",
    "material": "wet silk",
    "pussy": "shaved whore pussy",
    "cum": "clean whore",
    "pose": "whore presenting her holes",
    "lighting": "hotel room lighting",
    "imageStyle": "glamour photography",
    "perspective": "full body shot",
    "cameraSettings": "shot on Sony A7IV, 35mm lens, f/2.0, ISO 200"
  }
}