{
  "name": "Milf Whore",
  "icon": "fa-venus-double",
  "description": "Experienced mother whore",
  "settings": {
    "hairStyle": "brunette slut hair",
    "eyes": "sultry experienced whore eyes",
    "face": "experienced milf whore face",
    "lips": "natural whore lips",
    "makeup": "natural whore makeup",
    "bodyType": "milf whore body",
    "bust": "saggy milf whore tits",
    "ass": "saggy milf whore ass",
    "realismLevel": 10,
    "clothingStyle": "whore lingerie",
    "material": "lace lingerie",
    "pussy": "landing strip whore pussy",
    "cum": "creampie leaking from whore pussy",
    "pose": "missionary whore pose",
    "lighting": "amateur bedroom lighting",
    "imageStyle": "amateur photography",
    "perspective": "POV shot",
    "cameraSettings": "shot on professional DSLR, sharp focus"
  }
}